<?xml version="1.0" encoding="UTF-8"?>
<REST_File xmlns:xsi="http://www.w3.org/2001/XMLSchema-instance"
 xsi:noNamespaceSchemaLocation="RESTJSONXML/RESTJSONXML.xsd">
    
<currentVersion>10.51</currentVersion>
<serviceDescription/>
<mapName>Census Tracts and Blocks</mapName>
<description>Census Tracts, Census Block Groups, Census Blocks</description>
<copyrightText>Source: U.S. Census Bureau</copyrightText>
<supportsDynamicLayers>false</supportsDynamicLayers>
    <URL>https://tigerweb.geo.census.gov/arcgis/rest/services/TIGERweb/Tracts_Blocks/MapServer</URL>
<layers>
    <id>0</id>
    <name>Census Tracts</name>
    <parentLayerId>-1</parentLayerId>
    <defaultVisibility>true</defaultVisibility>
    <subLayerIds>null</subLayerIds>
    <minScale>1400000</minScale>
    <maxScale>1001</maxScale>
</layers>
<layers>
    <id>1</id>
    <name>Census Block Groups</name>
    <parentLayerId>-1</parentLayerId>
    <defaultVisibility>true</defaultVisibility>
    <subLayerIds>null</subLayerIds>
    <minScale>155000</minScale>
    <maxScale>1001</maxScale>
</layers>
<layers>
    <id>2</id>
    <name>2010 Census Blocks</name>
    <parentLayerId>-1</parentLayerId>
    <defaultVisibility>true</defaultVisibility>
    <subLayerIds>null</subLayerIds>
    <minScale>42000</minScale>
    <maxScale>1001</maxScale>
</layers>
<layers>
    <id>3</id>
    <name>ACS 2019</name>
    <parentLayerId>-1</parentLayerId>
    <defaultVisibility>true</defaultVisibility>
    <subLayerIds>4</subLayerIds>
    <subLayerIds>5</subLayerIds>
    <minScale>0</minScale>
    <maxScale>0</maxScale>
</layers>
<layers>
    <id>4</id>
    <name>Census Tracts</name>
    <parentLayerId>3</parentLayerId>
    <defaultVisibility>true</defaultVisibility>
    <subLayerIds>null</subLayerIds>
    <minScale>1400000</minScale>
    <maxScale>1001</maxScale>
</layers>
<layers>
    <id>5</id>
    <name>Census Block Groups</name>
    <parentLayerId>3</parentLayerId>
    <defaultVisibility>true</defaultVisibility>
    <subLayerIds>null</subLayerIds>
    <minScale>155000</minScale>
    <maxScale>1001</maxScale>
</layers>
<layers>
    <id>6</id>
    <name>ACS 2018</name>
    <parentLayerId>-1</parentLayerId>
    <defaultVisibility>false</defaultVisibility>
    <subLayerIds>7</subLayerIds>
    <subLayerIds>8</subLayerIds>
    <minScale>0</minScale>
    <maxScale>0</maxScale>
</layers>
<layers>
    <id>7</id>
    <name>Census Tracts</name>
    <parentLayerId>6</parentLayerId>
    <defaultVisibility>true</defaultVisibility>
    <subLayerIds>null</subLayerIds>
    <minScale>1400000</minScale>
    <maxScale>1001</maxScale>
</layers>
<layers>
    <id>8</id>
    <name>Census Block Groups</name>
    <parentLayerId>6</parentLayerId>
    <defaultVisibility>true</defaultVisibility>
    <subLayerIds>null</subLayerIds>
    <minScale>155000</minScale>
    <maxScale>1001</maxScale>
</layers>
<layers>
    <id>9</id>
    <name>Census 2010</name>
    <parentLayerId>-1</parentLayerId>
    <defaultVisibility>false</defaultVisibility>
    <subLayerIds>10</subLayerIds>
    <subLayerIds>11</subLayerIds>
    <subLayerIds>12</subLayerIds>
    <minScale>0</minScale>
    <maxScale>0</maxScale>
</layers>
<layers>
    <id>10</id>
    <name>Census Tracts</name>
    <parentLayerId>9</parentLayerId>
    <defaultVisibility>true</defaultVisibility>
    <subLayerIds>null</subLayerIds>
    <minScale>1400000</minScale>
    <maxScale>1001</maxScale>
</layers>
<layers>
    <id>11</id>
    <name>Census Block Groups</name>
    <parentLayerId>9</parentLayerId>
    <defaultVisibility>true</defaultVisibility>
    <subLayerIds>null</subLayerIds>
    <minScale>155000</minScale>
    <maxScale>1001</maxScale>
</layers>
<layers>
    <id>12</id>
    <name>Census Blocks</name>
    <parentLayerId>9</parentLayerId>
    <defaultVisibility>true</defaultVisibility>
    <subLayerIds>null</subLayerIds>
    <minScale>42000</minScale>
    <maxScale>1001</maxScale>
</layers>
<spatialReference>
    <wkid>102100</wkid>
    <latestWkid>3857</latestWkid>
</spatialReference>
<singleFusedMapCache>false</singleFusedMapCache>
<initialExtent>
    <xmin>-9184155.18168631</xmin>
    <ymin>3941007.1761029866</ymin>
    <xmax>-9158236.546515705</xmax>
    <ymax>3959420.890013748</ymax>
    <spatialReference>
        <wkid>102100</wkid>
        <latestWkid>3857</latestWkid>
    </spatialReference>
</initialExtent>
<fullExtent>
    <xmin>-20037700</xmin>
    <ymin>-1823163.166</ymin>
    <xmax>2.01161361532E7</xmax>
    <ymax>1.16719314944E7</ymax>
    <spatialReference>
        <wkid>102100</wkid>
        <latestWkid>3857</latestWkid>
    </spatialReference>
</fullExtent>
<minScale>1400000</minScale>
<maxScale>1001</maxScale>
<units>esriMeters</units>
<supportedImageFormatTypes>PNG32,PNG24,PNG,JPG,DIB,TIFF,EMF,PS,PDF,GIF,SVG,SVGZ,BMP</supportedImageFormatTypes>
<documentInfo>
    <Title/>
    <Author/>
    <Comments/>
    <Subject/>
    <Category/>
    <AntialiasingMode>None</AntialiasingMode>
    <TextAntialiasingMode>Force</TextAntialiasingMode>
    <Keywords/>
</documentInfo>
<capabilities>Map,Data,Query</capabilities>
<supportedQueryFormats>JSON, AMF, geoJSON</supportedQueryFormats>
<exportTilesAllowed>false</exportTilesAllowed>
<datumTransformations>
    <geoTransforms>
        <wkid>108001</wkid>
        <latestWkid>1241</latestWkid>
        <transformForward>true</transformForward>
        <name>NAD_1927_To_NAD_1983_NADCON</name>
    </geoTransforms>
</datumTransformations>
<datumTransformations>
    <geoTransforms>
        <wkid>108001</wkid>
        <latestWkid>1241</latestWkid>
        <transformForward>false</transformForward>
        <name>NAD_1927_To_NAD_1983_NADCON</name>
    </geoTransforms>
</datumTransformations>
<datumTransformations>
    <geoTransforms>
        <wkt>GEOGTRAN[&quot;WGS_1984_Major_Auxiliary_Sphere_To_WGS_1984&quot;,GEOGCS[&quot;GCS_WGS_1984_Major_Auxiliary_Sphere&quot;,DATUM[&quot;D_WGS_1984_Major_Auxiliary_Sphere&quot;,SPHEROID[&quot;WGS_1984_Major_Auxiliary_Sphere&quot;,6378137.0,0.0]],PRIMEM[&quot;Greenwich&quot;,0.0],UNIT[&quot;Degree&quot;,0.0174532925199433]],GEOGCS[&quot;GCS_WGS_1984&quot;,DATUM[&quot;D_WGS_1984&quot;,SPHEROID[&quot;WGS_1984&quot;,6378137.0,298.257223563]],PRIMEM[&quot;Greenwich&quot;,0.0],UNIT[&quot;Degree&quot;,0.0174532925199433]],METHOD[&quot;Longitude_Rotation&quot;]]</wkt>
        <transformForward>true</transformForward>
        <name>WGS_1984_Major_Auxiliary_Sphere_To_WGS_1984</name>
    </geoTransforms>
</datumTransformations>
<datumTransformations>
    <geoTransforms>
        <wkt>GEOGTRAN[&quot;WGS_1984_Major_Auxiliary_Sphere_To_WGS_1984&quot;,GEOGCS[&quot;GCS_WGS_1984_Major_Auxiliary_Sphere&quot;,DATUM[&quot;D_WGS_1984_Major_Auxiliary_Sphere&quot;,SPHEROID[&quot;WGS_1984_Major_Auxiliary_Sphere&quot;,6378137.0,0.0]],PRIMEM[&quot;Greenwich&quot;,0.0],UNIT[&quot;Degree&quot;,0.0174532925199433]],GEOGCS[&quot;GCS_WGS_1984&quot;,DATUM[&quot;D_WGS_1984&quot;,SPHEROID[&quot;WGS_1984&quot;,6378137.0,298.257223563]],PRIMEM[&quot;Greenwich&quot;,0.0],UNIT[&quot;Degree&quot;,0.0174532925199433]],METHOD[&quot;Longitude_Rotation&quot;]]</wkt>
        <transformForward>false</transformForward>
        <name>WGS_1984_Major_Auxiliary_Sphere_To_WGS_1984</name>
    </geoTransforms>
</datumTransformations>
<datumTransformations>
    <geoTransforms>
        <wkid>8088</wkid>
        <latestWkid>1188</latestWkid>
        <transformForward>true</transformForward>
        <name>NAD_1983_To_WGS_1984_1</name>
    </geoTransforms>
</datumTransformations>
<datumTransformations>
    <geoTransforms>
        <wkid>8088</wkid>
        <latestWkid>1188</latestWkid>
        <transformForward>false</transformForward>
        <name>NAD_1983_To_WGS_1984_1</name>
    </geoTransforms>
</datumTransformations>
<supportsDatumTransformation>true</supportsDatumTransformation>
<maxRecordCount>100000</maxRecordCount>
<maxImageHeight>4096</maxImageHeight>
<maxImageWidth>4096</maxImageWidth>
<supportedExtensions/>
</REST_File>

