<?xml version="1.0" encoding="UTF-8"?>
<REST_File xmlns:xsi="http://www.w3.org/2001/XMLSchema-instance"
 xsi:noNamespaceSchemaLocation="RESTJSONXML.xsd">
<currentVersion>10.51</currentVersion>
<serviceDescription>Military reservations</serviceDescription>
<mapName>Military and Other Special Land Use Areas</mapName>
<description>Military Installations; National Park Service Areas; Correctional Facilities; Colleges and Universities</description>
<copyrightText>Source: U.S. Census Bureau</copyrightText>
<supportsDynamicLayers>false</supportsDynamicLayers>
	<URL>https://tigerweb.geo.census.gov/arcgis/rest/services/TIGERweb/Special_Land_Use_Areas/MapServer</URL>
<layers>
	<id>0</id>
	<name>National Park Service Areas</name>
	<parentLayerId>-1</parentLayerId>
	<defaultVisibility>true</defaultVisibility>
	<subLayerIds>null</subLayerIds>
	<minScale>6000000</minScale>
	<maxScale>1001</maxScale>
</layers>
<layers>
	<id>1</id>
	<name>Correctional Facilities</name>
	<parentLayerId>-1</parentLayerId>
	<defaultVisibility>true</defaultVisibility>
	<subLayerIds>null</subLayerIds>
	<minScale>650000</minScale>
	<maxScale>1001</maxScale>
</layers>
<layers>
	<id>2</id>
	<name>Colleges and Universities</name>
	<parentLayerId>-1</parentLayerId>
	<defaultVisibility>true</defaultVisibility>
	<subLayerIds>null</subLayerIds>
	<minScale>650000</minScale>
	<maxScale>1001</maxScale>
</layers>
<layers>
	<id>3</id>
	<name>Military Installations</name>
	<parentLayerId>-1</parentLayerId>
	<defaultVisibility>true</defaultVisibility>
	<subLayerIds>null</subLayerIds>
	<minScale>2500000</minScale>
	<maxScale>1001</maxScale>
</layers>
<spatialReference>
	<wkid>102100</wkid>
	<latestWkid>3857</latestWkid>
</spatialReference>
<singleFusedMapCache>false</singleFusedMapCache>
<initialExtent>
	<xmin>-8578496.601600984</xmin>
	<ymin>4701429.293652466</ymin>
	<xmax>-8565119.24151293</xmax>
	<ymax>4710933.145993503</ymax>
	<spatialReference>
		<wkid>102100</wkid>
		<latestWkid>3857</latestWkid>
	</spatialReference>
</initialExtent>
<fullExtent>
	<xmin>-1.92056364568E7</xmin>
	<ymin>-1950939.5312</ymin>
	<xmax>1.95172767756E7</xmax>
	<ymax>1.09460453884E7</ymax>
	<spatialReference>
		<wkid>102100</wkid>
		<latestWkid>3857</latestWkid>
	</spatialReference>
</fullExtent>
<minScale>6000000</minScale>
<maxScale>1001</maxScale>
<units>esriMeters</units>
<supportedImageFormatTypes>PNG32,PNG24,PNG,JPG,DIB,TIFF,EMF,PS,PDF,GIF,SVG,SVGZ,BMP</supportedImageFormatTypes>
<documentInfo>
	<Title>Military Reservations</Title>
	<Author/>
	<Comments>Military reservations</Comments>
	<Subject/>
	<Category/>
	<AntialiasingMode>None</AntialiasingMode>
	<TextAntialiasingMode>Force</TextAntialiasingMode>
	<Keywords/>
</documentInfo>
<capabilities>Map,Data,Query</capabilities>
<supportedQueryFormats>JSON, AMF, geoJSON</supportedQueryFormats>
<exportTilesAllowed>false</exportTilesAllowed>
<datumTransformations>
	<geoTransforms>
		<wkid>108001</wkid>
		<latestWkid>1241</latestWkid>
		<transformForward>true</transformForward>
		<name>NAD_1927_To_NAD_1983_NADCON</name>
	</geoTransforms>
</datumTransformations>
<datumTransformations>
	<geoTransforms>
		<wkid>108001</wkid>
		<latestWkid>1241</latestWkid>
		<transformForward>false</transformForward>
		<name>NAD_1927_To_NAD_1983_NADCON</name>
	</geoTransforms>
</datumTransformations>
<datumTransformations>
	<geoTransforms>
		<wkt>GEOGTRAN[&quot;WGS_1984_Major_Auxiliary_Sphere_To_WGS_1984&quot;,GEOGCS[&quot;GCS_WGS_1984_Major_Auxiliary_Sphere&quot;,DATUM[&quot;D_WGS_1984_Major_Auxiliary_Sphere&quot;,SPHEROID[&quot;WGS_1984_Major_Auxiliary_Sphere&quot;,6378137.0,0.0]],PRIMEM[&quot;Greenwich&quot;,0.0],UNIT[&quot;Degree&quot;,0.0174532925199433]],GEOGCS[&quot;GCS_WGS_1984&quot;,DATUM[&quot;D_WGS_1984&quot;,SPHEROID[&quot;WGS_1984&quot;,6378137.0,298.257223563]],PRIMEM[&quot;Greenwich&quot;,0.0],UNIT[&quot;Degree&quot;,0.0174532925199433]],METHOD[&quot;Longitude_Rotation&quot;]]</wkt>
		<transformForward>true</transformForward>
		<name>WGS_1984_Major_Auxiliary_Sphere_To_WGS_1984</name>
	</geoTransforms>
</datumTransformations>
<datumTransformations>
	<geoTransforms>
		<wkt>GEOGTRAN[&quot;WGS_1984_Major_Auxiliary_Sphere_To_WGS_1984&quot;,GEOGCS[&quot;GCS_WGS_1984_Major_Auxiliary_Sphere&quot;,DATUM[&quot;D_WGS_1984_Major_Auxiliary_Sphere&quot;,SPHEROID[&quot;WGS_1984_Major_Auxiliary_Sphere&quot;,6378137.0,0.0]],PRIMEM[&quot;Greenwich&quot;,0.0],UNIT[&quot;Degree&quot;,0.0174532925199433]],GEOGCS[&quot;GCS_WGS_1984&quot;,DATUM[&quot;D_WGS_1984&quot;,SPHEROID[&quot;WGS_1984&quot;,6378137.0,298.257223563]],PRIMEM[&quot;Greenwich&quot;,0.0],UNIT[&quot;Degree&quot;,0.0174532925199433]],METHOD[&quot;Longitude_Rotation&quot;]]</wkt>
		<transformForward>false</transformForward>
		<name>WGS_1984_Major_Auxiliary_Sphere_To_WGS_1984</name>
	</geoTransforms>
</datumTransformations>
<datumTransformations>
	<geoTransforms>
		<wkid>8088</wkid>
		<latestWkid>1188</latestWkid>
		<transformForward>true</transformForward>
		<name>NAD_1983_To_WGS_1984_1</name>
	</geoTransforms>
</datumTransformations>
<datumTransformations>
	<geoTransforms>
		<wkid>8088</wkid>
		<latestWkid>1188</latestWkid>
		<transformForward>false</transformForward>
		<name>NAD_1983_To_WGS_1984_1</name>
	</geoTransforms>
</datumTransformations>
<supportsDatumTransformation>true</supportsDatumTransformation>
<maxRecordCount>100000</maxRecordCount>
<maxImageHeight>4096</maxImageHeight>
<maxImageWidth>4096</maxImageWidth>
<supportedExtensions/>
</REST_File>
